Student Number,Score,Comment,Citations
26,14.0,"Good answer — you correctly explained that BPR is needed so workflows match the new EHR (instead of simply copying broken legacy processes), and you noted that BPR removes waste, smooths information flow, and makes the system easier for staff to use, which supports better patient care. To improve, add a couple concrete examples from the lecture (e.g., mapping As-Is to Should-Be processes, preventing lost records/missed documentation, and standardizing processes across sites) to show deeper alignment with the course material. Overall this demonstrates strong understanding but could use slightly more detail to reach full credit. Per Module 1 lecture materials 【4:2†Module 1 Lecture Materials.pdf】.",Module 1 Lecture Materials.pdf
12,13.0,"Good work — you identified many relevant issues that require BPR (data segregation for research/population health, accurate billing and inventory, clinician communication, privacy/accountability including AI, clinical alerts, and interoperability with labs/radiology). These points align well with the lecture emphasis that processes must be mapped and standardized to improve quality, safety, efficiency, and data reuse when implementing an HIS/EHR 【4:2†Module 1 Lecture Materials.pdf】 【4:2†Mod 1 BPR & Workflow - Lecture Slides.pdf】. To reach full credit, make the causal links clearer by stating how BPR specifically addresses each issue (for example: reducing redundancy and missed documentation, improving interoperability and procurement decisions, and increasing return on IT investments) — this explicit mapping of issue → BPR action → expected benefit is what the slides expect. Overall strong answer; tighten the why/how explanations next time.","Module 1 Lecture Materials.pdf, Mod 1 BPR & Workflow - Lecture Slides.pdf"
24,14.0,"Good job. You correctly identified several important issues that require BPR (identifying/correcting workflow flaws, reducing waste and costs, optimizing staff/resources and training, regulatory/standards considerations, and improving patient care and business health). These map well to the lecture discussion about mapping As‑Is vs ideal processes and the goals of making processes better, faster, and cheaper (improving quality, reducing cost and risk) as part of HIS/EHR implementation 【4:2†Module 1 Lecture Materials.pdf】. To improve your answer, make the link stronger between each issue and specific BPR mechanisms (for example: reducing redundancy, enabling reuse of information/components, improving interoperability and procurement decisions, and increasing ROI) and include a concrete short example of one process change.",Module 1 Lecture Materials.pdf
27,14.0,"Good work — you clearly explained that paper-based workflows often cannot be directly moved into an EHR and that redesign is needed to avoid inefficiency and errors. You also tied BPR to improved patient care, reduced repetition, and better staff adoption, which matches lecture points. To earn full credit, be more explicit about the BPR process (map As-Is vs ideal) and mention additional benefits discussed in the slides such as the “better, faster, cheaper” goals, reduced risk/interoperability gains, and alignment with federal EHR requirements to strengthen your justification (see Module 1 lecture materials). 【4:2†Module 1 Lecture Materials.pdf】 【4:2†Module 1 Lecture Materials.pdf】","Module 1 Lecture Materials.pdf - Business Process Re-engineering / Benefits section 【4:2†Module 1 Lecture Materials.pdf】, Module 1 Lecture Materials.pdf - Federal EHR Requirements / Balanced Performance Model 【4:2†Module 1 Lecture Materials.pdf】"
10,14.0,"Good answer — you correctly identified that EHR implementations are complex and that BPR is a structured, established tool to manage that complexity and to refactor existing (often chaotic) human and technical workflows instead of leaving reform to individuals. To reach full credit, connect this idea to concrete BPR goals from the lecture: map the As‑Is vs Should‑Be processes, standardize workflows to avoid lost information/missed documentation, and achieve improvements that can be “better, faster, cheaper” (quality, speed, cost), plus IT benefits like reduced redundancy and improved interoperability. See the Module 1 lecture discussion of BPR benefits and the need to start with the As‑Is process 【4:2†Module 1 Lecture Materials.pdf】 and the Mod 1 BPR & Workflow slides describing process mapping steps and the five‑question BPR approach 【4:2†Mod 1 BPR & Workflow - Lecture Slides.pdf】.","Module 1 Lecture Materials.pdf, Mod 1 BPR & Workflow - Lecture Slides.pdf"
28,16.0,"Excellent answer — you clearly identified the workflow elements that need BPR (steps, people, data) and explained why re-engineering is required (to define how the EHR must function, to adapt workflows to the system, eliminate unnecessary steps, and ensure the EHR supports organizational goals). This aligns well with the lecture points about mapping As-Is to Should-Be processes and the goals of making processes better/faster/cheaper as part of HIS/EHR implementation 【4:2†Module 1 Lecture Materials.pdf】 【4:2†Mod 2 HIS & EHR Clinical Functionality-Lecture Slides.pdf】. To strengthen your answer further next time, mention the explicit benefit outcomes emphasized in the slides (e.g., reduced lost records, improved quality measures, and reduced errors) and the importance of involving stakeholders in the process map.","Module 1 Lecture Materials.pdf, Mod 2 HIS & EHR Clinical Functionality-Lecture Slides.pdf"
31,13.5,"Good work — you identified key issues BPR addresses (redundancy, efficiency, cross-department information flow) and correctly linked standardization and embedded decision support to reduced errors and lower transition costs. To reach full credit, expand to the required length and add more detail from the slides (for example, process mapping of As-Is vs. To-Be, that simply digitizing workflows is not enough, and the broader benefits such as reduced risk, cost reduction, and improved care coordination). Next time include those specifics and a clearer statement of how BPR produces measurable ROI to fully cover both rubric dimensions.","Module 1 Lecture Materials.pdf - Benefits of Doing BPR, Module 1 Lecture Materials.pdf - Lecture 2: Healthcare Workflow and Business Process Re-Engineering"
15,4.0,"You have the basic idea correct: BPR is used to extract requirements and create an improved system that delivers better results. That is a valid point and shows you understand the high-level goal of re-engineering. However, the answer is too short and lacks details the lectures emphasize (for example, mapping the As-Is process vs. the ideal process, identifying gaps, reducing redundancy, preventing lost records/missed documentation, and improving quality/safety and interoperability). Expand to 4–5 sentences and cite specific reasons from the Module 1 materials (e.g., how BPR supports better/faster/cheaper outcomes and standardization) to earn more points. 【4:2†Module 1 Lecture Materials.pdf】 【4:2†Mod 1 BPR & Workflow - Lecture Slides.pdf】","【4:2†Module 1 Lecture Materials.pdf】, 【4:2†Mod 1 BPR & Workflow - Lecture Slides.pdf】"
11,14.0,"Good answer — you clearly identified relevant issues (paper-to-digital workload, redundancy/outdated steps, and the need for process alignment) and explained how BPR streamlines work, aligns processes to the EHR, and supports consistent care leading to better outcomes. To improve, mention the importance of mapping the As‑Is process before redesign (to avoid designing from perceived rather than real workflows) and give one specific benefit from the slides (for example, preventing lost records or enabling alerts for drug interactions) to strengthen the rationale.",Module 1 Lecture Materials.pdf
20,15.0,"Good work — you identified several key issues that BPR targets (standardization across providers, reducing duplicate tests, improved communication/coordination, and increased patient safety via alerts) and explained how BPR/EHR changes address each one. These points align well with the lecture’s list of BPR benefits (better/faster/cheaper, reduced risk such as drug-interaction alerting, and improved access to unified information) 【4:2†Module 1 Lecture Materials.pdf】. To reach full points, briefly mention the importance of process mapping (As‑Is → To‑Be) so your answer shows awareness of how BPR is carried out in practice (start with the real current process before redesigning) 【4:2†Mod 1 BPR & Workflow - Lecture Slides.pdf】. Overall a clear, relevant answer — watch spelling/grammar next time to improve readability.","Module 1 Lecture Materials.pdf, Mod 1 BPR & Workflow - Lecture Slides.pdf"
3,16.0,"Excellent answer. You correctly identified the key issues that require BPR (paper or legacy processes, inefficiency and safety risks, need to document As-Is workflows, and involve stakeholders) and you clearly explained why BPR is needed (reduce cost and waste, improve efficiency, safety and patient outcomes, and to configure the EHR to match redesigned workflows). This matches lecture points that BPR moves processes from As-Is to Should-Be to make them “better, faster, cheaper,” reduce errors, and improve availability and communication 【4:2†Module 1 Lecture Materials.pdf】 【4:2†Mod 1 BPR & Workflow - Lecture Slides.pdf】. To improve further, you could explicitly mention interoperability, reuse/reduction of redundancy, and procurement/ROI benefits as additional concrete outcomes from BPR discussed in the course materials.","Module 1 Lecture Materials.pdf, Mod 1 BPR & Workflow - Lecture Slides.pdf, Mod 2 HIS & EHR Clinical Functionality-Lecture Slides.pdf"
7,16.0,"Excellent answer. You correctly explained that implementing an EHR is more than swapping paper for computers and that current workflows and habits (the As-Is processes) often don’t fit digital systems, so processes must be redesigned. You also clearly stated why BPR is needed — to improve efficiency, reduce duplication, enhance safety, and support user adoption so the EHR delivers its intended benefits rather than slowing work down. This aligns with the lecture materials on BPR benefits and workflow mapping 【4:2†Module 1 Lecture Materials.pdf】 【4:2†Mod 1 BPR & Workflow - Lecture Slides.pdf】.","Module 1 Lecture Materials.pdf, Mod 1 BPR & Workflow - Lecture Slides.pdf"
13,16.0,"Excellent answer — you correctly explain that EHR implementation changes how work is done and therefore requires BPR to remove redundant manual steps, embed safety checks, improve access to information and decision support, and realign staff roles and workflows. This matches the lecture emphasis on mapping the As‑Is process, defining an improved ideal process, and achieving better/faster/cheaper outcomes through standardization and automation. For small improvement, you could explicitly name the process‑mapping step (As‑Is vs Should‑Be) or note that BPR can require upfront investment even when it yields long‑term quality and efficiency gains. Overall, a clear, well‑focused response that demonstrates understanding of course concepts.","Module 1 Lecture Materials.pdf, Mod 1 BPR & Workflow - Lecture Slides.pdf"
14,15.0,"Good answer — you clearly identified the problems that BPR addresses (paper/legacy workflows, need to capture clinical and operational requirements, and adoption risks) and explained why BPR is needed (to preserve functional goals while gaining digitization efficiencies, ensure stakeholder buy-in, and leverage EHR integration/interoperability to add value). To reach full credit, you could explicitly reference process-mapping ideas from the lecture (As-Is vs perceived vs ideal) and name some concrete BPR benefits emphasized in the slides such as reduced errors, greater availability of information, and the “better, faster, cheaper” framing. Overall well-written and demonstrates solid understanding tied to EHR implementation concerns.","Module 1 Lecture Materials.pdf, Mod 1 BPR & Workflow - Lecture Slides.pdf"
18,15.0,"Good answer — you clearly identified the key issues that require BPR (safety, efficiency, quality of care, data sharing, and workflow alignment) and explained how BPR and workflow redesign address them (streamlining communication, reducing errors, getting staff buy-in, and making better use of funds and technology). That matches the lecture points about BPR producing “better, faster, cheaper” outcomes and improving effectiveness, efficiency, and safety when implementing an HIS/EHR 【4:2†Module 1 Lecture Materials.pdf】. To reach full credit, you could briefly mention the importance of starting with the As‑Is process and mapping to the ideal process (process mapping) and note other organizational benefits such as reduced IT redundancy, improved interoperability, and simpler procurement discussed in the slides 【4:2†Mod 1 BPR & Workflow - Lecture Slides.pdf】.","Module 1 Lecture Materials.pdf, Mod 1 BPR & Workflow - Lecture Slides.pdf"
19,15.0,"Good answer — you clearly identified key problems BPR addresses (inefficient and inconsistent workflows, errors/patient safety, duplication, poor communication) and explained how BPR helps (redesign/standardize workflows, reduce redundancy, lower costs, and make the EHR a dependable tool to support care). To reach full credit, briefly mention BPR activities emphasized in the lecture (e.g., mapping the real “As‑Is” process, considering reuse/interoperability and organizational alignment with mission/regulation) to show the connection to practical BPR steps. Overall strong and aligned with the course material.","Module 1 Lecture Materials.pdf, Mod 1 BPR & Workflow - Lecture Slides.pdf"
21,13.5,"Good work — you clearly identified pre-EHR problems (manual charting, manual ordering, faxing) and gave a concrete example of how BPR can enable automated, decision-support driven ordering. You also noted using BPR to find bottlenecks and improve efficiency, which ties well to the lecture’s goals of making processes “better, faster, cheaper.” To reach full credit, make the connection more explicit to process-mapping and the full set of BPR benefits discussed in the slides (for example: standardization to reduce redundancy, improved interoperability and data reuse, and cost/procurement advantages).","Module 1 Lecture Materials.pdf 【4:2†Module 1 Lecture Materials.pdf】, Mod 1 BPR & Workflow - Lecture Slides.pdf 【4:2†Mod 1 BPR & Workflow - Lecture Slides.pdf】"
22,15.0,"Good work — you identified the main issues that trigger BPR (inefficiency, waste, bottlenecks, redundancy, and user adoption/implementation risks) and explained how BPR addresses them by clarifying requirements, capturing clinician input, and structuring implementation to avoid chaos and overspending. These points align well with the lecture emphasis on mapping the As‑Is process, involving clinicians and patients, and aiming for “better, faster, cheaper” outcomes 【4:2†Module 1 Lecture Materials.pdf】. To improve, briefly mention process‑mapping terminology (As‑Is vs perceived vs Should‑Be) and emphasize how BPR also supports IT optimization, standardization, and procurement/interoperability to strengthen the argument 【4:2†Mod 1 BPR & Workflow - Lecture Slides.pdf】.","Module 1 Lecture Materials.pdf, Mod 1 BPR & Workflow - Lecture Slides.pdf"
23,15.0,"Good answer — you clearly identified many problems that BPR must address (workflow mapping, reducing redundancy, standardizing steps, ensuring correct patient information) and explained how BPR helps (improves care quality, saves time and costs, enables better use of EHR data). That aligns well with the lecture emphasis on mapping As-Is processes, standardizing workflows, and making processes “better, faster, cheaper.” To improve: tie your points to specific BPR steps from the slides (for example, starting with the As‑Is process vs perceived process) and avoid asserting items not shown in the lecture materials (your HIPAA compliance mention is reasonable but not explicitly covered in the provided slides). Overall solid coverage of both the issues and why BPR is needed.","【4:2†Module 1 Lecture Materials.pdf】, 【4:2†Module 1 Lecture Materials.pdf】, 【4:2†Mod 1 BPR & Workflow - Lecture Slides.pdf】"
25,13.0,"Good concise answer — you correctly identified that EHR implementation changes the sequence of tasks, who performs them, and the information required at each step, and that existing workflows cannot simply be assumed to work unchanged. That point aligns with the lecture emphasis on mapping current (As‑Is) processes and re‑engineering them for digital systems 【4:2†Module 1 Lecture Materials.pdf】 【4:2†Mod 1 BPR & Workflow - Lecture Slides.pdf】. To earn full credit, expand briefly on why BPR is needed to address those changes (for example: to improve quality and safety, reduce redundancy, better align technology with goals, and produce more efficient, lower‑cost workflows) and give a short example of a workflow change; those reasons are described in the Module 1 materials. Overall: clear and correct but a bit short on the specific benefits BPR provides as linked to the issues you named.","Module 1 Lecture Materials.pdf, Mod 1 BPR & Workflow - Lecture Slides.pdf"
30,16.0,"Excellent answer — the factory analogy is apt and you correctly identify the need to map and adapt real workflows, involve frontline staff, and prioritize accuracy to avoid go‑live failures. You also tie BPR to making the EHR transition smooth, compliant, and to improving care quality and operational efficiency, which aligns with the lecture emphasis on mapping the As‑Is process and achieving “better, faster, cheaper” outcomes 【4:2†Module 1 Lecture Materials.pdf】. To strengthen an already strong response, you could briefly call out specific IT/organizational benefits BPR enables (for example reducing redundancy, improving interoperability, and lowering long‑term costs) to explicitly link to the detailed benefits listed in the lecture slides 【4:2†Module 1 Lecture Materials.pdf】.",Module 1 Lecture Materials.pdf
2,13.5,"You correctly identified several key issues that BPR must address when implementing an EHR—aligning clinical/workflow processes with the system, ensuring data integrity for clinical decision-making, improving efficiency and quality of care, and protecting patient information. These points are supported by the Module 1 lecture materials and the BPR & Workflow slides, which emphasize mapping As‑Is to To‑Be processes, preventing lost records/missed documentation, and improving quality, safety, availability, and communication 【4:2†Module 1 Lecture Materials.pdf】 【4:2†Mod 1 BPR & Workflow - Lecture Slides.pdf】. To reach full credit, expand briefly on how BPR accomplishes each goal (for example: process mapping to identify gaps, standardization to reduce redundancy and errors, enabling interoperability and decision support, and designing controls for privacy/security), citing specific BPR actions described in the slides. Good concise answer—next time add one sentence per issue linking it to a concrete BPR activity from the lecture materials.","Module 1 Lecture Materials.pdf, Mod 1 BPR & Workflow - Lecture Slides.pdf"
6,14.0,"Good work — you identified several important issues (paper-to-digital alone is insufficient; legacy workflows can be redundant, error-prone, and misaligned with EHR processes) and explained how BPR streamlines order entry, documentation, communication, reduces mistakes/delays, and improves productivity and care quality, which aligns with the lecture benefits of BPR and HIS/EHR implementations (Module 1 Lecture Materials.pdf 【4:2†Module 1 Lecture Materials.pdf】; Mod 1 BPR & Workflow - Lecture Slides.pdf 【4:2†Mod 1 BPR & Workflow - Lecture Slides.pdf】). To improve, explicitly mention the process-mapping step (As‑Is vs ideal), the value of standardizing processes across sites, and the IT/ROI and interoperability/procurement benefits described in the slides — that would fully cover the rubric’s “why” dimension. Overall a solid answer with clear reasoning; add a brief note on mapping and standardization to earn full credit.","Module 1 Lecture Materials.pdf, Mod 1 BPR & Workflow - Lecture Slides.pdf"
9,13.0,"Good job identifying that EHR implementation involves many processes and that BPR gives a structured way to map current (As‑Is) processes, identify gaps, and evaluate options for improvement. You also correctly note that BPR helps select the best approach and can save time, money, and resources—this aligns with the lecture’s point that BPR + HIS/EHR aims to make processes better, faster, and cheaper 【4:2†Module 1 Lecture Materials.pdf】. To strengthen your answer, include more concrete reasons from the slides (for example: reducing redundancy and reuse of systems, improving interoperability and IT efficiency, aligning processes with organizational mission and external regulations, and enabling faster/cheaper procurement).",Module 1 Lecture Materials.pdf 【4:2†Module 1 Lecture Materials.pdf】
8,16.0,"Excellent answer — you correctly identify the core problems that BPR addresses (changes to work and information flow, and the danger of simply automating bad processes) and clearly explain why re-engineering is required so the EHR supports clinical work, improves efficiency, and avoids creating new problems. To strengthen future answers, you could briefly mention the BPR steps (map As-Is, define To-Be) or the “better, faster, cheaper” framing used in the lecture to tie your points to concrete process-mapping actions. Overall this is accurate, concise, and aligned with the lecture materials. 【4:2†Module 1 Lecture Materials.pdf】",Module 1 Lecture Materials.pdf (Business Process Re-engineering section)
16,16.0,"Excellent answer — you clearly identified the need to map the As‑Is process, find redundant or irrational steps, and show how BPR produces a ‘to‑be’ workflow that aligns EHR capabilities with organizational goals to reduce steps, standardize protocols, improve efficiency, and reduce errors. This matches the lecture emphasis on starting with the reality (As‑Is) process and producing improved workflows and benefits such as better, faster, cheaper outcomes. To strengthen further, you could briefly mention some of the IT/operational outcomes discussed in the slides (for example interoperability, lower maintenance costs, and clearer procurement decisions). Per the course materials: see Module 1 lecture notes on BPR benefits and mapping 【4:2†Module 1 Lecture Materials.pdf】 and the Mod 1 BPR & Workflow slides on workflow mapping and critical issues 【4:2†Mod 1 BPR & Workflow - Lecture Slides.pdf】.","Module 1 Lecture Materials.pdf, Mod 1 BPR & Workflow - Lecture Slides.pdf"
29,15.0,"Good work. You correctly explained that BPR requires mapping the actual “as‑is” workflow and designing a “to‑be” process so the EHR doesn't just automate outdated practices, and you identified key outcomes — eliminating inefficiencies, reducing errors, clarifying roles/data needs, and building staff buy‑in — which align with the lecture material 【4:2†Module 1 Lecture Materials.pdf】. To strengthen the answer, add an explicit link to the measurable organizational/IT benefits the slides highlight (for example: increased efficiency, reduced risk, and better return on investment — the “better, faster, cheaper” idea) and mention concrete examples such as reducing redundancy or improving interoperability to show deeper engagement with the rubric 【4:2†Mod 1 BPR & Workflow - Lecture Slides.pdf】.","Module 1 Lecture Materials.pdf, Mod 1 BPR & Workflow - Lecture Slides.pdf"
1,14.0,"Good answer — you correctly identified key problems (complex, paper-based workflows and redundant steps) and explained why BPR is needed: to analyze care delivery, streamline steps, reduce redundancy, and improve care quality and efficiency. That aligns well with the lecture points that BPR maps the As‑Is process, defines the ideal process, and aims for processes that are better/faster/cheaper while preventing lost records and missed documentation 【4:2†Module 1 Lecture Materials.pdf】. To reach full credit, explicitly mention process‑mapping steps (start with the reality/As‑Is process vs perceived), and note additional BPR benefits discussed in the slides such as standardization for consistent care, enabling quality measures in the EHR, and improved interoperability/IT efficiency 【4:2†Mod 1 BPR & Workflow - Lecture Slides.pdf】.","Module 1 Lecture Materials.pdf, Mod 1 BPR & Workflow - Lecture Slides.pdf"
4,14.0,"Good job — your answer correctly identifies important issues (paper-based inefficiency, redundant steps) and explains why BPR is needed (improved data accuracy, better communication, faster care, and meeting regulatory needs). To improve, explicitly mention process mapping (As‑Is vs ideal) and standardization (which the slides link to reduced lost records/missed documentation and the ‘better, faster, cheaper’ goal) to tie your points more directly to lecture concepts. Overall this is a clear, accurate response that would earn strong credit.","Module 1 Lecture Materials.pdf 【4:2†Module 1 Lecture Materials.pdf】, Module 1 Lecture Materials.pdf 【4:2†Module 1 Lecture Materials.pdf】"
